{
  "contract_version": "1.0.0",
  "criterion_profile": "conservative-screening-v1",
  "observed_rate_mol_m3_s": 0.01,
  "particle_radius_m": 0.00005,
  "surface_reactant_concentration_mol_m3": 10.0,
  "bulk_reactant_concentration_mol_m3": 10.0,
  "effective_diffusivity_m2_s": 0.000001,
  "reaction_order_abs": 1.0,
  "external_mass_transfer_coefficient_m_s": 0.1,
  "reaction_enthalpy_abs_j_mol": 165000.0,
  "activation_energy_j_mol": 80000.0,
  "temperature_k": 493.15,
  "external_heat_transfer_coefficient_w_m2_k": 1000.0,
  "relative_uncertainty_fraction": {"effective_diffusivity_m2_s": 0.2, "external_mass_transfer_coefficient_m_s": 0.2, "external_heat_transfer_coefficient_w_m2_k": 0.2},
  "source_ids": ["synthetic-demonstration-not-experimental-evidence"],
  "field_sources": {
    "observed_rate_mol_m3_s": "synthetic-demonstration-not-experimental-evidence",
    "particle_radius_m": "synthetic-demonstration-not-experimental-evidence",
    "surface_reactant_concentration_mol_m3": "synthetic-demonstration-not-experimental-evidence",
    "bulk_reactant_concentration_mol_m3": "synthetic-demonstration-not-experimental-evidence",
    "effective_diffusivity_m2_s": "synthetic-demonstration-not-experimental-evidence",
    "reaction_order_abs": "synthetic-demonstration-not-experimental-evidence",
    "external_mass_transfer_coefficient_m_s": "synthetic-demonstration-not-experimental-evidence",
    "reaction_enthalpy_abs_j_mol": "synthetic-demonstration-not-experimental-evidence",
    "activation_energy_j_mol": "synthetic-demonstration-not-experimental-evidence",
    "temperature_k": "synthetic-demonstration-not-experimental-evidence",
    "external_heat_transfer_coefficient_w_m2_k": "synthetic-demonstration-not-experimental-evidence"
  },
  "weisz_prater_limit": 0.3,
  "mears_mass_limit": 0.15,
  "mears_heat_limit": 0.15,
  "gas_constant_j_mol_k": 8.314462618,
  "recommendation_blocked": true
}
